rating,reviewerID,asin,reviewText,summary,title
5.0,ANV9L0JU6BNL,B000052YAN,"best floss i've used. does not break as easily as others, and i have tight teeth.",best floss i've used,"Reach Dentotape Waxed Dental Floss with Extra Wide Cleaning Surface for Large Spaces between Teeth, Unflavored, 100 Yards"
5.0,ANV9L0JU6BNL,B000052YAN,"best floss i've used. does not break as easily as others, and i have tight teeth.",best floss i've used,"Reach Dentotape Waxed Dental Floss with Extra Wide Cleaning Surface for Large Spaces between Teeth, Unflavored, 100 Yards"
2.0,A2TU781PWGS09X,B00006L9LC,Doesnt smell,Two Stars,Citre Shine Moisture Burst Shampoo - 16 fl oz
2.0,A2TU781PWGS09X,B00006L9LC,Doesnt smell,Two Stars,Citre Shine Moisture Burst Shampoo - 16 fl oz
5.0,A3A8F2URN7MEPR,B00006L9LC,My favorite powder!,Five Stars,Citre Shine Moisture Burst Shampoo - 16 fl oz
5.0,A3A8F2URN7MEPR,B00006L9LC,My favorite powder!,Five Stars,Citre Shine Moisture Burst Shampoo - 16 fl oz
2.0,A2TU781PWGS09X,B000URXP6E,Doesnt smell,Two Stars,Bonne Bell Smackers Bath and Body Starburst Collection
5.0,A3A8F2URN7MEPR,B000URXP6E,My favorite powder!,Five Stars,Bonne Bell Smackers Bath and Body Starburst Collection
2.0,A2TU781PWGS09X,B0012Y0ZG2,Doesnt smell,Two Stars,Bath &amp; Body Works Ile De Tahiti Moana Coconut Vanille Moana Body Wash with Tamanoi 8.5 oz
5.0,A3A8F2URN7MEPR,B0012Y0ZG2,My favorite powder!,Five Stars,Bath &amp; Body Works Ile De Tahiti Moana Coconut Vanille Moana Body Wash with Tamanoi 8.5 oz
2.0,A2TU781PWGS09X,B0012Y0ZG2,Doesnt smell,Two Stars,Bath &amp; Body Works Ile De Tahiti Moana Coconut Vanille Moana Body Wash with Tamanoi 8.5 oz
5.0,A3A8F2URN7MEPR,B0012Y0ZG2,My favorite powder!,Five Stars,Bath &amp; Body Works Ile De Tahiti Moana Coconut Vanille Moana Body Wash with Tamanoi 8.5 oz
5.0,ANV9L0JU6BNL,B0015S8026,"A good product, a good seller, a good price. Sorry for the abbreviated review, but it annoys me that Amazon compels reviews to be so long. If I have anything important to add, I will. Otherwise, its hard to expand on the virtues of a USB cable, paper towels or socks.",great zit gel.,"Zapzyt Maximum Strength 10% Benzoyl Peroxide Acne Treatment Gel, 1 Ounce"
5.0,ANV9L0JU6BNL,B0015S8026,"A good product, a good seller, a good price. Sorry for the abbreviated review, but it annoys me that Amazon compels reviews to be so long. If I have anything important to add, I will. Otherwise, its hard to expand on the virtues of a USB cable, paper towels or socks.",great zit gel.,"Zapzyt Maximum Strength 10% Benzoyl Peroxide Acne Treatment Gel, 1 Ounce"
2.0,A2TU781PWGS09X,B001OHV1H4,Doesnt smell,Two Stars,"Avalon Grapefruit and Geranium Smoothing Shampoo, 11 Ounce"
5.0,A3A8F2URN7MEPR,B001OHV1H4,My favorite powder!,Five Stars,"Avalon Grapefruit and Geranium Smoothing Shampoo, 11 Ounce"
5.0,ANV9L0JU6BNL,B001QY8QXM,"best blades for the money. these are my everday go-go blades. great price, very comfy, and a good smooth blade for beginners.",best blades for the money.,"Astra Platinum Double Edge Safety Razor Blades ,100 Blades (20 x 5)"
5.0,A1U8L4X1O2LXXF,B00FE90M0K,"Amazing Toner/Prep by Mehron....OMG...you too can have a smooth looking face with makeup a day after shaving or immediately. Very, very, nice...and it does even out skin tone.  I use it with Be Pro Setting Spray. Mehron has their own setting spray...I'm sure it very, very nice too.",Mehron No Sweat Skin Prep Pro Primer 4.0 oz,Mehron Makeup Skin Prep Pro (4 oz)
5.0,A38IPSLKOQ5O2F,B00L62HMQG,"Fast delivery. I expected soe of the gems to be gone, but that never happened. Super excited!",Super excited!,Vktech&reg; 20pcs Mix Colors Rhinestone Nose Studs Ring Bone Bar Pin Piercing Jewelry
3.0,A38IPSLKOQ5O2F,B00NW59IM6,"Its a lot bigger than I thought, and the magnet doesn't stay like it should, But it looks like the picture and i still love it!.",and the magnet doesn't stay like it should,Vintage Cinderella Pumpkin Carriage Locket Pendant Chain Necklace Xmas Gift
5.0,A1U8L4X1O2LXXF,B00O9UPRCS,I've tried many things to apply costume makeup as an eyeliner...and this is the only thing that works so far without the makeup running into each other.  Excellent.  Thank you.  The eyeliners work great..they're just not dark enough with the black.,Professional Waterproof Black Elegant Eyeliner,Professional Waterproof Black Elegant EyeLiner Beauty Gel Mascara + Eyeliner Brush Makeup Tools
5.0,A38IPSLKOQ5O2F,B00RIWAJCM,Fits perfectly and looks fantastic. So glad I ordered this!,Five Stars,Charming Silver Colored Earring / Ear Cuff / Clip In Snake / Spiral Shape By VAGA
5.0,A1U8L4X1O2LXXF,B010B5ZE4U,Great product highlighter with shimmer....may need a good foundation base underneath....it does feel cool to my skin but my skin feels a bit more dry.  I do like look...but prefer my skin soft and supple.,Sugar Box...Great Product,Maquita Waterproof Portable Face Facial Highlighter Stick Shimmer Powder Makeup Silver
5.0,A1U8L4X1O2LXXF,B010B5ZE4U,Provides a nice shimmer that can be blended in and provides a nice feel and glide to the skin.  I do have fair skin and prefer the shimmer blended...  Great product.  Its very light...but might need a good foundation base to work best with the product or not... While it does feel cool to my skin...it does feel drier  I prefer my skin supple.,Sugar Box,Maquita Waterproof Portable Face Facial Highlighter Stick Shimmer Powder Makeup Silver
3.0,A38IPSLKOQ5O2F,B010L79142,"The lipstick is good, but it was broken when I received it in the mail. So, i ended up holding the tip in my hand to use it.","The lipstick is good, but it was broken when I received it ...",ROPALIA Cosmetic Makeup Waterproof Moisturize Lipstick Lip Stick Lip Gloss
5.0,A38IPSLKOQ5O2F,B019DWCJDG,Its so awesome i've recommended it to all my friends already.,Five Stars,Weixinbuy 1PC Secret Jelly Lipstick Color Changing Long Lasting Lip Gloss Random Color
2.0,ANV9L0JU6BNL,B01A4XPV56,"Barely smell it, but at least it smells  vaguely of oud.",Barely smell it - REALLY light aroma,"Oud Wood Oil. IMPRESSION of Tom Ford Oud Wood* Cologne for Men with SIMILAR Fragrance Accords, 10ml Amber Glass Roller, Black Cap; 100% Pure (Perfume Studio Oud Wood VERSION/TYPE; Not Original Brand)"
4.0,A38IPSLKOQ5O2F,B01DWBI43I,"This is the best I've tried so far. But, you have to wait for it to dry or it will stick to everything.",This is the best I've tried so far,ABASSKY Lip Gloss Lipstick Matte Velvet Waterproof Super Long Lasting Not Fade (#18)
5.0,A1U8L4X1O2LXXF,B01GZWUSYY,"Serum...I'm used to serum now.  So the benefits are endless...with Vit. C.  Now 24K active gold, ginseng extract,collagen, jojoba oil,etc...does promise to make the youthful effects a bit more interesting while providing the benefits of all of these ingredients....jojoba and ginseng in particular are of great interest and are well known for rehydrating and rejuvenating and improving metabolism...skin, hair, nails, musculature, etc Which might also promise to improve such things as injuries, diabetis, thyroid issues, psoriasis, fibroid myalgia, scoliosis, old scars etc...please seek advice from your doctor and corresponding medical specialist.  Vit C has been approved for years and most get their youthful qualities of natural serums by eating proteins and collagen in their daily meals. So the evidence is quite outstanding and plenty of research is available.",Spdoo Women Pure 24K Gold Essence Anti Wrinkle.,BIOAQUA 24K Gold Essence Collagen Skin Face Moisturizing Hyaluronic Acid Mask
5.0,A1U8L4X1O2LXXF,B00T5W0GKS,"Nice, spreads well.... But do make sure you get a good toner prior to applying anything and before you start. I'm using Mehron Skin Prep and it works wonderfully...the effects are amazing...you too can have a smooth face after shaving 24hrs later or immediately...it does even out skin tone.  Yes, the foundation by Urparcel Liquid Foundation Smooth Natural Long Lasting works great.",Urparcel Liquid Foundation Smooth Natural Long Lasting,Urparcel Liquid Foundation Smooth Natural Long Lasting Makeup Beauty Cosmetics
5.0,A3A8F2URN7MEPR,B00VARTPKS,My favorite powder!,Five Stars,(Pack of 3) L.A. Colors Mineral Pressed Powder #Mp303 &quot;Creamy Natural&quot;
5.0,A1U8L4X1O2LXXF,B017LU859E,Great palate for travelling or all around use.  Easy to store and tranport.  The colours are very true to description or as illustrated. Thank you. Love it.,Orangesky Professional 15 Concealer Camouflage...,Orangesky Professional 15 Concealer Camouflage Foundation Makeup Palette
2.0,A2TU781PWGS09X,B019V2KYZS,Doesnt smell,Two Stars,"Dolce &amp; Gabbana Compact Parfum, 0.05 Ounce"
5.0,A38IPSLKOQ5O2F,B01FQQMNLQ,Absolutely wonderful!! Such a cheap price and great quality. I've already gotten so many compliments.,Five Stars,Sankuwen 15PCs Wool Makeup Brush Set Tools Toiletry Kit
