overall,verified,reviewTime,reviewerID,asin,reviewerName,reviewText,summary,unixReviewTime,vote,style,image,category,tech1,description,fit,title,also_buy,tech2,brand,feature,rank,also_view,details,main_cat,similar_item,date,price,imageURL,imageURLHighRes
5.0,True,"07 6, 2016",A3GOAK3HUD7G93,B001QY8QXM,Chepair,"great blade! Only last a 2 - 3 shaves, but the pack is enough to last almost 2 years, so it's a no brainer in terms of cost.  Really close shaves and no bumps at all.
I use the Astra with a Micro Touch Safety Razor Chrome",great blade! Only last a 2 - 3 shaves,1467763200,,{'Size:': ' 1-Count'},,[],,"['ASTRA stainless double edge blades fit all double edge razors. ASTRA blades are made from the highest quality steel. Each ASTRA blade provides unsurpassed quality, smoothness and durability for a long lasting, smooth shave.']",,"Astra Platinum Double Edge Safety Razor Blades ,100 Blades (20 x 5)",[],,Astra,[],280 in Beauty & Personal Care (,"['B00DQ2W7UK', 'B00PKHIDRA', 'B07CGMTVM4', 'B07MB4LZC4', 'B079J73FPY', 'B079WD5NHB', 'B00P33OASW', 'B01N6EEZ60', 'B07HPBV5BZ', 'B07MB4M31Z', 'B01F90ZOCY', 'B004SGKMA0', 'B073F55BLC', 'B0038KA5RC', 'B00TCPD9Y8', 'B002G2VENC', 'B077VNWG5P', 'B001OXV7T0', 'B07BJ16CD9', 'B00VZ29TC2', 'B079WQNW2P', 'B00K8RFS48', 'B00306PJD4', 'B004RWTQTS', 'B009HLMNB2', 'B07K8X9ZY6', 'B00PKGXZ24', 'B06XWBDQ6L', 'B004QPRUX0', 'B001QYE0LE', 'B079VJSFCK', 'B003NTHWLU', 'B00XLMZ0LI', 'B07B2R5SBW', 'B079W9DBNW', 'B00UN0LUWE', 'B00P8NXAGA', 'B07GQ8RP13', 'B00AIMLE3M', 'B06ZY8C7Z3', 'B01M1VGXT1', 'B019QLSRT4', 'B06XW9WZLM', 'B01M19NYOQ', 'B01N30YG1P', 'B0727KW2BC', 'B06ZYX4JW9', 'B01377129K', 'B00UVSEA5M', 'B004E5GV82', 'B002OCANQI', 'B06XGVRQKP', 'B01HE0FCAG', 'B01I9TILPO', 'B002IFFSOS', 'B01LRQAN3Y', 'B00KO46CTA', 'B00FGI0I2Q', 'B01E5J5SW6']","{'\n    Product Dimensions: \n    ': '8 x 1.5 x 8 inches ; 6 pounds', 'Shipping Weight:': '3.7 ounces (', 'ASIN: ': 'B001QY8QXM', 'UPC:': '883887205580 885125364455 879488268956 883173235017 622200155726', 'Item model number:': 'ASTRA01'}",All Beauty,,,$9.30,"['https://images-na.ssl-images-amazon.com/images/I/41Y5iGLoyEL._SS40_.jpg', 'https://images-na.ssl-images-amazon.com/images/I/41Cl6JLvlmL._SS40_.jpg', 'https://images-na.ssl-images-amazon.com/images/I/41Y51wgaCcL._SS40_.jpg', 'https://images-na.ssl-images-amazon.com/images/I/31CywxO4d2L._SS40_.jpg', 'https://images-na.ssl-images-amazon.com/images/I/41U3sosyCoL._SS40_.jpg', 'https://images-na.ssl-images-amazon.com/images/I/31zLJIZGysL._SS40_.jpg']","['https://images-na.ssl-images-amazon.com/images/I/41Y5iGLoyEL.jpg', 'https://images-na.ssl-images-amazon.com/images/I/41Cl6JLvlmL.jpg', 'https://images-na.ssl-images-amazon.com/images/I/41Y51wgaCcL.jpg', 'https://images-na.ssl-images-amazon.com/images/I/31CywxO4d2L.jpg', 'https://images-na.ssl-images-amazon.com/images/I/41U3sosyCoL.jpg', 'https://images-na.ssl-images-amazon.com/images/I/31zLJIZGysL.jpg']"
4.0,False,"02 15, 2011",AUHTRRMV9PX6W,B0012SOTRY,Bob Roberts,"I had run out of tincture of iodine.  Looking for more I bought Iodides Tincture (decolorized iodine) at a supermarket. When I opened the container what a surprise.  Ammonia! Very strong!

I know solid iodine is insoluble in most things so a potassium iodide solution is used as primer.  That, in alcohol, will disburse (not dissolve) iodine crystals giving the characteristic dark color.

In this case, using stronger ammonia for the solvent plus an alcoholic potassium iodide solution will dissolve ammonium iodide to give a clear, ionic solution. Clever.

To check that it really is iodine, wet a tissue with hydrogen peroxide and put on it a drop of the iodides solution. In five minutes iodine is released and the the dark color develops.

For years I have been fighting toe fungus. In recent years I found that ordinary, cheap vinegar was properly acidic to promptly kill fungus, so I used that. It works well.  I had thought about using iodine but toenail discoloration stopped me.

Well, now the answer was at hand so I tried using the Iodides Tincture for about a year. No color. I find it works well topically however a fungus spot developed under the nail and was not stopped by the either the Iodides or Vinegar on the surface. The regular tincture of Iodine slowly diffuses into the nail and has stopped that problem but of course I have a yellow toe nail.",A mistake that turned out good,1297728000,4,,,[],,"['Iodides tincture colorless, 1 ounce bottle is useful in first aid to help prevent infection in minor cuts, scrapes and burns.']",,"Iodides tincture for first aid treatment by prefered plus, colorless - 1 Oz",[],,Preferred Plus,[],"1,294,237 in Beauty & Personal Care (",[],"{'Shipping Weight:': '4 ounces', 'ASIN: ': 'B0012SOTRY', 'UPC:': '300829331010'}",All Beauty,,,,[],[]
4.0,False,"01 3, 2010",A11R8Z92FVB84G,B000V003WY,Roxy,"I don't know if it really helps attract the opposite sex but I like how it smells and I feel nice wearing it. My boyfriend enjoys it also, he says the smell is a little comforting to him. I think it was worth the buy.",I like it,1262476800,,,,[],,['Get noticed! The Climax X Factor Pheromone Cologne is made to help attract the opposite sex. Simply spray on a light amount of X Factor and let the men come to you!\n\n1.12 inches long'],,Climax xfactor pheromone cologne for her - natural 1 oz,[],,Topco,[],"2,955,681 in Beauty & Personal Care (",[],"{'\n    Item Weight: \n    ': '3.04 ounces', 'Shipping Weight:': '1.2 pounds', 'ASIN: ': 'B000V003WY'}",All Beauty,,,,[],[]
4.0,True,"11 2, 2016",A2NSZSRXAHZ67J,B010B5ZE4U,Devyn Mullen,"Although shipping took about a month, I am satisfied with this product. It applies very easily and it gives off an amazing sparkly glow!",Satisfied,1478044800,,,,[],,[],,Maquita Waterproof Portable Face Facial Highlighter Stick Shimmer Powder Makeup Silver,"['B01FD9X3B0', 'B01L6YYDCY', 'B00EL1HZ34', 'B01DPA7900', 'B00PGQYEUK', 'B00IQDPZJO', 'B01KV7DXCI', 'B0192LUH9Q', 'B01MQ4YOPR', 'B07GXDMMSK', 'B010TF8LXS', 'B01KJ9QOOM', 'B018794UQK', 'B00B4YVU4G', 'B00BEWNYNS', 'B00VKIJPNE', 'B00T3VL8BC', 'B001IAINFU']",,,[],"113,909 in Beauty & Personal Care (",[],"{'Shipping Weight:': '0.8 ounces (', 'ASIN: ': 'B010B5ZE4U', 'UPC:': '781549635853 600686175162 755332568833 600686175155'}",All Beauty,,,$7.99,"['https://images-na.ssl-images-amazon.com/images/I/41PFsmuAVsL._SS40_.jpg', 'https://images-na.ssl-images-amazon.com/images/I/41UdHMvBwvL._SS40_.jpg', 'https://images-na.ssl-images-amazon.com/images/I/414yf39Gf%2BL._SS40_.jpg']","['https://images-na.ssl-images-amazon.com/images/I/41PFsmuAVsL.jpg', 'https://images-na.ssl-images-amazon.com/images/I/41UdHMvBwvL.jpg', 'https://images-na.ssl-images-amazon.com/images/I/414yf39Gf%2BL.jpg']"
5.0,True,"05 19, 2015",A3OAT0M0RPPLZJ,B00HU6W3UW,Ali Perry,"If you've never used Kama Sutra products, THIS is the one to start with - it's delicious (literally) and also a wonderful gossamer-light powder to brush onto fresh sheets so your bed smells INCREDIBLE when you get into it. A great gift - certainly one that will make people giggle (until you tell them about the linen freshening...hehe).",Stop what you're doing and buy this NOW,1431993600,6,,,[],,['Kama Sutra Honey Dust Raspberry Body Powder'],,Kama Sutra Honey Dust Body Powder,"['B000RGD8AQ', 'B006973REO']",,kwanjai shop,[],"506,893 in Beauty & Personal Care (",['B000RGD8AQ'],"{'Shipping Weight:': '13.4 ounces (', 'ASIN: ': 'B00HU6W3UW'}",All Beauty,,,$14.00,[],[]
