overall,verified,reviewTime,reviewerID,asin,reviewerName,reviewText,summary,unixReviewTime,vote,style,image,category,tech1,description,fit,title,also_buy,tech2,brand,feature,rank,also_view,details,main_cat,similar_item,date,price,imageURL,imageURLHighRes
4.0,False,"03 12, 2016",A3BZ41DNI1M70R,B011I8D6L2,Renae O,Seeing a difference good product,Four Stars,1457740800,,,,[],,"[""The secret to younger, clearer skin restore your skin to it's former beauty it is time to actively take care of your skin with CLIA Beauty's stretch mark cream. This powerful concentrated blend of hydrating moisturizer is the gateway to kick start your skin health. Clia's stretch mark cream is made with vitamin e, retinol, jojoba, and other proven natural and organic ingredients for maximum skin hydration. Whether your stretch marks are from extreme weight loss, pregnancy, weight lifting, puberty, or you are wanting to prevent your skin from showing signs of stretching this cream was created with you in mind. Clia's stretch mark cream is the perfect blend of ingredients to give your body the highest level of moisture that your skin needs, guaranteed the cream is so hydrating that you will want to slather it all over your leathery skin like a body butter. It will actively prevent stretch marks and scarring of the skin. We promise that you will see drastic results when you apply this stretch mark removal and prevention cream to problem areas of your body that need the extra attention. Clia's formulators work intensely to find the best blends of ingredients to give the best results to everyone that uses our stretch mark cream. At CLIA Beauty, we want to provide the best formula with the best ingredients. Why clia is better - superior results - formulation with 98% efficacy - made and developed in the USA , fda lab.""]",,"CLIA Beauty Retinol Moisturizer For Stretch Mark Scars With Collagen, Caffeine and Vitamin E, Helps Remove and Prevent New And Old Stretch Marks and Scars, Best Formula For Pregnant And Nursing Moms",[],,CLIA Beauty,[],"354,811 in Beauty & Personal Care (","['B01ES349CY', 'B07C9TY3BZ', 'B07GPJ3LBB', 'B077T2GMFG', 'B00OAMTSJ8', 'B07B6H2V7G', 'B07111BY6Q', 'B06WP3D8NS', 'B07M6WXVMN', 'B015XWJ3OS', 'B00GGLKVEM', 'B07GSZ7C21']","{'\n    Product Dimensions: \n    ': '3.4 x 3.4 x 3.2 inches', 'Shipping Weight:': '4 ounces', 'ASIN: ': 'B011I8D6L2', 'UPC:': '635682794277', 'Item model number:': '635682794277'}",All Beauty,,,,[],[]
3.0,True,"04 15, 2018",A399AIJAPY54CV,B01BE1Q7H8,picturethisone,As expected,Three Stars,1523750400,,,,[],,[],,Goody Ouchless Hair Scrunchies Navy Blue Black Red 5 Pieces,[],,,[],"781,571 in Beauty & Personal Care (","['B071YZ2YWW', 'B01724RRF2', 'B07982YHBQ', 'B00NE44WD0', 'B00FU7PZ3K', 'B079MJQQP6']","{'Shipping Weight:': '0.3 ounces', 'ASIN: ': 'B01BE1Q7H8', 'UPC:': '784179863726 755332167265'}",All Beauty,,,,['https://images-na.ssl-images-amazon.com/images/I/512S5hSovpL._SS40_.jpg'],['https://images-na.ssl-images-amazon.com/images/I/512S5hSovpL.jpg']
1.0,True,"01 13, 2018",AWL94N7FMZI3M,B01C3GPXG4,bcfdtaylor33 ,So disappointed. Was excited about getting these pretty bottles and they came today and they was all thrown into one bag all apart. All the paint is chipped off all the bottles every single bottle had large paint chip marks in them. I would do a refund bc I am highly upset but I need a roller bottle now Im just gonna have to deal with them for now until I can get better ones.,Horrible!!! Disappointed!,1515801600,,,"['https://images-na.ssl-images-amazon.com/images/I/71c1jywJfiL._SY88.jpg', 'https://images-na.ssl-images-amazon.com/images/I/71cA82xRKiL._SY88.jpg']",[],,[],,"Roller Ball Bottles in Metallic Finish (8 pack), 10ml Multi-Color Glass Roll On Bottles for Perfume, Essential Oils, Lip Balm, &amp; More","['B011M3YK1S', 'B01BFDRX8C', 'B01BFE0SJM', 'B01LLRH0Y4', '1540665275', 'B019T6MJEU', '153069079X', 'B01HRERL76', 'B01JSGS2NI', '171887068X', 'B00PEUVPZU', 'B01BFE7NL8', 'B01JGUIKOW', 'B00QSIJZYA']",,,[],"495,882 in Beauty & Personal Care (","['B07J3Z8RB4', 'B079HB4RKR', 'B076JBYZQN']","{'Shipping Weight:': '9.1 ounces', 'ASIN: ': 'B01C3GPXG4'}",All Beauty,,,,"['https://images-na.ssl-images-amazon.com/images/I/61Y8J9tJl5L._SS40_.jpg', 'https://images-na.ssl-images-amazon.com/images/I/41lQvlxWYeL._SS40_.jpg', 'https://images-na.ssl-images-amazon.com/images/I/41n4TI4uUSL._SS40_.jpg', 'https://images-na.ssl-images-amazon.com/images/I/51VijbbLHOL._SS40_.jpg', 'https://images-na.ssl-images-amazon.com/images/I/51PBIBZhufL._SS40_.jpg', 'https://images-na.ssl-images-amazon.com/images/I/51wJHUiDsYL._SS40_.jpg']","['https://images-na.ssl-images-amazon.com/images/I/61Y8J9tJl5L.jpg', 'https://images-na.ssl-images-amazon.com/images/I/41lQvlxWYeL.jpg', 'https://images-na.ssl-images-amazon.com/images/I/41n4TI4uUSL.jpg', 'https://images-na.ssl-images-amazon.com/images/I/51VijbbLHOL.jpg', 'https://images-na.ssl-images-amazon.com/images/I/51PBIBZhufL.jpg', 'https://images-na.ssl-images-amazon.com/images/I/51wJHUiDsYL.jpg']"
5.0,True,"01 8, 2017",A1FO73VJ2EZLXC,B01H72S7JE,Alysia North,My daughter fell in love with this mirror it was well worth the money,Five Stars,1483833600,,,,[],,[],,Beautify Mirrored Jewelry Armoire with LED Lights - Floor Standing Organizer Cabinet with Internal &amp; External Mirror - White,[],,,[],"657,059 in Beauty & Personal Care (","['B077NHFKLT', 'B0778N3KBS', 'B01MU7YSQD', 'B07BPVTNNW', 'B06ZYRZ687', 'B07CKXGX9R', 'B00DIIZ0KQ', 'B071NXSR2R', 'B07GSXPRBX', 'B076BNQ2J4', 'B01EYEBS4O']","{'Shipping Weight:': '26.9 pounds', 'ASIN: ': 'B01H72S7JE'}",All Beauty,,,,"['https://images-na.ssl-images-amazon.com/images/I/51R4WWABWvL._SS40_.jpg', 'https://images-na.ssl-images-amazon.com/images/I/31jcJzWppPL._SS40_.jpg', 'https://images-na.ssl-images-amazon.com/images/I/41XPBqOeTKL._SS40_.jpg', 'https://images-na.ssl-images-amazon.com/images/I/511Py97GcqL._SS40_.jpg', 'https://images-na.ssl-images-amazon.com/images/I/51UAZwkDzCL._SS40_.jpg', 'https://images-na.ssl-images-amazon.com/images/I/51DCkTfksvL._SS40_.jpg']","['https://images-na.ssl-images-amazon.com/images/I/51R4WWABWvL.jpg', 'https://images-na.ssl-images-amazon.com/images/I/31jcJzWppPL.jpg', 'https://images-na.ssl-images-amazon.com/images/I/41XPBqOeTKL.jpg', 'https://images-na.ssl-images-amazon.com/images/I/511Py97GcqL.jpg', 'https://images-na.ssl-images-amazon.com/images/I/51UAZwkDzCL.jpg', 'https://images-na.ssl-images-amazon.com/images/I/51DCkTfksvL.jpg']"
5.0,True,"04 11, 2016",ALHCMTDIKWJC2,B00RFE2W5A,Sarah,"Best moisturizer I've found at any price. You won't be disappointed. I have good skin to begin with, but this got me through the winter beautifully moisturizer.",Great,1460332800,,,,[],,"['', '<b>What are the Unique Advantages of Genesea Dead Sea Products?</b>', '<b>Helps Restore a More Youthful Appearance to Your Skin</b>', '<b>Reasons to Buy:</b>', '<b>More Reasons to Buy:</b>', 'For all of our Genesea products, we provide a 30-day money-back guarantee, no questions asked.']",,"Genesea Hydrating Mineral Night Cream with 3% Retinol &amp; Collagen - Helps Improve the Appearance of Fine Lines, Wrinkles &amp; Dry Texture - Premium anti aging skin care facial moisturizer, Paraben Free",[],,Genesea,[],"70,380 in Beauty & Personal Care (","['B00RFNQ7HU', 'B07BX65SLW', 'B07D1RXQ8X', 'B00N9D8PES', 'B01I0BQWQG', 'B00V1DFYH4', 'B072MYZV4R', 'B00U6T4ZY2', 'B01LZASEKG', 'B07J2W7YBP', 'B01M4R7CC5', 'B073T1SYNK', 'B06X9ZCFG4', 'B00NVSSUUU', 'B073ZQ7MWZ', 'B076214CP5', 'B07CQKW3YK', 'B005713US6', 'B01B0YGMGU', 'B015ORL3B8', 'B07F7MBMJ2', 'B07FFDDKP5', 'B00117F5PG', 'B07436B1M9', 'B00IQ21TK4', 'B0796XKYBJ', 'B07B7Q5NDD', 'B07L4KLW2P', 'B07FNJMHR2', 'B00IRE2YWS', 'B072N42W6J', 'B07DD5VQGP', 'B079HNJLRC', 'B00G0EJYFW', 'B071S8B5H7', 'B01M4QFA2M', 'B000VEWF2Q', 'B00MH4U9EE', 'B00TACV1FM', 'B076FSCGLD', 'B004I14JCC', 'B07967FDWG', 'B01FLO5914', 'B01ES349CY', 'B07D2W4WJV', 'B00KSJA7HE', 'B07F2QGPHV', 'B075MZ615R', 'B00MSSJP9Y', 'B076X8GD6M', 'B0151F5QRA', 'B076FGDPZ9', 'B01FB8DWB4']","{'Shipping Weight:': '6.4 ounces (', 'ASIN: ': 'B00RFE2W5A', 'Item model number:': 'night cream'}",All Beauty,,,$22.95,"['https://images-na.ssl-images-amazon.com/images/I/51AXA1XGWCL._SS40_.jpg', 'https://images-na.ssl-images-amazon.com/images/I/51jIFmprs3L._SS40_.jpg', 'https://images-na.ssl-images-amazon.com/images/I/41iC31-WKXL._SS40_.jpg', 'https://images-na.ssl-images-amazon.com/images/I/61gu7g%2BwjdL._SS40_.jpg', 'https://images-na.ssl-images-amazon.com/images/I/41nwCT1YTCL._SS40_.jpg', 'https://images-na.ssl-images-amazon.com/images/I/5183WucF4eL._SS40_.jpg']","['https://images-na.ssl-images-amazon.com/images/I/51AXA1XGWCL.jpg', 'https://images-na.ssl-images-amazon.com/images/I/51jIFmprs3L.jpg', 'https://images-na.ssl-images-amazon.com/images/I/41iC31-WKXL.jpg', 'https://images-na.ssl-images-amazon.com/images/I/61gu7g%2BwjdL.jpg', 'https://images-na.ssl-images-amazon.com/images/I/41nwCT1YTCL.jpg', 'https://images-na.ssl-images-amazon.com/images/I/5183WucF4eL.jpg']"
2.0,True,"04 27, 2015",A5W21FCENJQ4Q,B004XISHKU,Miss M,"Disappointed in this color.  I got both Red and Black - same brand. The black is perfect - goes on nice.... the red is water.  VERY thin, very liquidy - took 6-10 coats (I lost count) to cover my arm whereas the black took 3 to get a nice even opaque coat.",Bad batch? Red is too liquidy,1430092800,,{'Color:': ' Red'},,[],,"['Liquid Latex Fashions manufactures liquid latex body paint in a variety of colors, these body paints are made with the highest quality of FDA approved ingredients. Because our product is made with FDA approved ingredients this body paint is safe for adults and children over the age of 6 years old. Our product will not stain your skin and will not rub off on your clothing. Best of all it will not take hours to remove off of your skin, you will simply peel off the paint when you are finished. Liquid Latex Fashions will ship worldwide and offers Express and Ground shipping through UPS. Because we are the manufacturer we are able to mix custom colors and provide the technical assistance that you may need in creating your custom costumes and designs, you can reach us at 1.888.774.7246.']",,Ammonia Free Liquid Latex Body Paint - 32oz Red,[],,Jubujub,[],"1,248,628 in Beauty & Personal Care (",[],"{'Shipping Weight:': '2.2 pounds', 'ASIN: ': 'B004XISHKU', 'UPC:': '885258996554 885524339078'}",All Beauty,,,,"['https://images-na.ssl-images-amazon.com/images/I/41Iv9UulJjL._SS40_.jpg', 'https://images-na.ssl-images-amazon.com/images/I/418mcLLrwLL._SS40_.jpg', 'https://images-na.ssl-images-amazon.com/images/I/419KKm2ePtL._SS40_.jpg', 'https://images-na.ssl-images-amazon.com/images/I/41snH6XU7PL._SS40_.jpg', 'https://images-na.ssl-images-amazon.com/images/I/61iohGXrh7L._SS40_.jpg', 'https://images-na.ssl-images-amazon.com/images/I/51Cp39Do%2BtL._SS40_.jpg']","['https://images-na.ssl-images-amazon.com/images/I/41Iv9UulJjL.jpg', 'https://images-na.ssl-images-amazon.com/images/I/418mcLLrwLL.jpg', 'https://images-na.ssl-images-amazon.com/images/I/419KKm2ePtL.jpg', 'https://images-na.ssl-images-amazon.com/images/I/41snH6XU7PL.jpg', 'https://images-na.ssl-images-amazon.com/images/I/61iohGXrh7L.jpg', 'https://images-na.ssl-images-amazon.com/images/I/51Cp39Do%2BtL.jpg']"
2.0,True,"06 24, 2015",A13C9P0UH3D6O8,B00B46UFD6,Beverly L Rowland,I was expecting a lotion with some tingle but this has none. It smells nice and it moisturizes my ski but I can't tell that it's done anything to improve or maintain my tan.,Won't buy again,1435104000,,,,[],,"['Spiked with Cellulite Fighting & Skin Firming Technologies *Gluten & Oil Free* This dark tanning maximizer utilizes the skin toning and tightening benefits of Revita Fit, Ideal Lift and Body, have a Blonde Moment. Advanced Matrixyl Synthe 6  Powerful antiaging peptide that reduces the appearance of fine lines and wrinkles for longlasting results. Revita Fit  Tones and tightens the skin. Body Fit Technology  Reduces the appearance of cellulite and restores firmness. Idea Lift fights sagging skin for a toner, more youthful appearance. Deep tanning stimulators allow for deep, dark gorgeous color without the use of bronzer. Phloritan  Antioxidant blend that works to reduce dark spots and even out skin tone. FreshTek  Proprietary blend of deodorizing and skin freshening ingredients. Blended with multiple accelerators that work to target melanin production and achieve fast, dark tanning results. Fragrance: Sweet Black Lotus']",,2013 Devoted Creations Blonde Obsession - Cellulite Fighting &amp; Skin Firming Maximizer Formula 12.25 oz,[],,Devoted Creations,[],"207,359 in Beauty & Personal Care (","['B00CG2FA0K', 'B015NH8NZS', 'B009YKK78C', 'B07FTXB29Q', 'B00P1CJQ5W', 'B07BTGLQ7P']","{'\n    Item Weight: \n    ': '15.2 ounces', 'Shipping Weight:': '15.2 ounces (', 'ASIN: ': 'B00B46UFD6', 'UPC:': '609224540400 885465391227 885145837137 885318192384 885711767943 787734401142'}",All Beauty,,,$22.95,['https://images-na.ssl-images-amazon.com/images/I/21t3H9RxSZL._SS40_.jpg'],['https://images-na.ssl-images-amazon.com/images/I/21t3H9RxSZL.jpg']
5.0,True,"03 22, 2012",A1BMG0TNV7KWSC,B000FOI48G,S. Mccoy,A must have for anyone with braces! My teeth feel like I just had a dental cleaning once I am finished.,Great for braces!,1332374400,,,,[],,"[""Premium dental water jet with dramatically improved design, large selection of accessories. Dentists' choice. Clinically proven. Covered lid tip storage. 6 tips included: 2 Classic Jet Tip, Plaque Seeker Tip, Orthodontic Tip, Pik Pocket Tip and Toothbrush Tip."", '<div class=""aplus""> <div class=""fourth-col""> <div class=""leftImage"" style=""width: 193px;""> <img src=""https://images-na.ssl-images-amazon.com/images/G/01/hpc/detail-page/c26-B000GLRREU-woman-small.jpg"" width=""193"" height=""300"" border=""0"" alt=""Waterpik Water Flossers are the easy and more effective way to floss""> <br><br><br><br> </div> <div class=""leftImage"" style=""width: 285px;""> <a href=""https://images-na.ssl-images-amazon.com/images/G/01/hpc/detail-page/c26-B000GLRREU-gingivitis-reduction.jpg"" title=""Learn more about reducing gingivitis""> <img src=""https://images-na.ssl-images-amazon.com/images/G/01/hpc/detail-page/c26-B000GLRREU-gingivitis-reduction-small.jpg"" width=""285"" height=""245"" border=""0"" alt=""Reduce gingivitis with a Waterpik Water Flosser""></a> <div class=""imageCaption"">The Waterpik Water Flosser is more effective than Sonicare Air Floss for improving gum health. <a href=""https://images-na.ssl-images-amazon.com/images/G/01/hpc/detail-page/c26-B000GLRREU-gingivitis-reduction.jpg"">View larger</a></div> <br><br><br><br> </div> <div class=""leftImage"" style=""width: 298px;""> <a href=""https://images-na.ssl-images-amazon.com/images/G/01/hpc/detail-page/c26-B000GLRREU-water-flosser-tip-guide-large.jpg"" title=""Learn more about Water Flosser tips""><img src=""https://images-na.ssl-images-amazon.com/images/G/01/hpc/detail-page/c26-B000GLRREU-water-flosser-tip-guide-small.jpg"" width=""298"" height=""230"" border=""0"" alt=""""> </a><div class=""imageCaption""> <a href=""https://images-na.ssl-images-amazon.com/images/G/01/hpc/detail-page/c26-B000GLRREU-water-flosser-tip-guide-large.jpg"" title="""">View the Water Flosser Tip Selector Guide</a></div> </div> </div> <div class=""half-col""> <h4>The Easy and More Effective Way to Floss</h4>', ""The Waterpik Water Flosser is the easy and more effective way to floss. And it's perfect for anyone with braces, implants, crowns, bridges, or periodontal pockets. Water flossing for about a minute a day comfortably removes up to 99.9% of plaque from treated areas as it gently massages the gums to improve overall oral health. Waterpik Water Flossers are the only brand clinically proven to be up to 50% more effective than traditional dental floss and up to 80% more effective than Sonicare Air Floss for improving gum health."", ""Whether you prefer gentle water pressure or deep cleansing, the Ultra Water Flosser's 10 adjustable water-pressure settings give you optimal control. Select a personalized setting between 10 to 90 PSI with 1,400 pulses per minute to keep your gums healthy. The Ultra Water Flosser cleans deep between teeth and below the gumline, while massaging and stimulating the gums. Clinical studies show that when used regularly, the Ultra Water Flosser gives you healthier gums in just 14 days."", ""The Ultra Water Flosser's improved design features a high-volume, covered reservoir with an in-lid tip storage compartment. It is also smaller and quieter than previous models. And its ergonomic handle design is comfortable to hold and offers a convenient pause button."", 'Since 1962, Water Pik, Inc. has been a leader in developing and manufacturing innovative personal and oral health care products. Over the years, Water Pik has acquired more than 500 patents, maintaining a steadfast commitment to developing innovative products that enable people to treat themselves better. Waterpik brand products are recognized for their award-winning design and technology.', 'With the number-one recommended Water Flosser, Waterpik is one of the most trusted oral-health brands of dental professionals throughout the world. The company is committed to developing products that not only enhance the health and well-being of customers, but also conserve water and energy.', '<img src=""https://images-na.ssl-images-amazon.com/images/G/01/hpc/detail-page/c26-B000GLRREU-upto-999p.jpg"" width=""160"" height=""155"" border=""0"" alt=""Remove plaque"" ><br> <b>Effective Plaque Removal</b><br><small>Proven in laboratory tests to remove up to 99.9% of plaque from treated areas in 3 seconds.</small>', '<img src=""https://images-na.ssl-images-amazon.com/images/G/01/hpc/detail-page/c26-B000GLRREU-upto-50p.jpg"" width=""160"" height=""155"" border=""0"" alt=""Improve gum health""><br> <b>Improved Gum Health</b><br><small>Clinically proven up to 50% more effective than dental floss for improving gum health.</small>', '<img src=""https://images-na.ssl-images-amazon.com/images/G/01/hpc/detail-page/c26-B000GLRREU-upto-3X.jpg"" width=""160"" height=""155"" border=""0"" alt=""Clean braces more effectively""><br> <b>Superior Cleaning Around Braces</b><br><small>Clinically proven up to 3X as effective as dental floss for cleaning around braces with the orthodontic tip.</small>', '<img src=""https://images-na.ssl-images-amazon.com/images/G/01/hpc/detail-page/c26-B000GLRREU-14day.jpg"" width=""160"" height=""155"" border=""0"" alt=""14 days for healthier gums, guaranteed""><br> <b>Healthier Gums Guaranteed</b><br><small>If you aren\'t satisfied that your gums are healthier after using the Waterpik Water Flosser for 14 days, feel free to return it to us for a full refund.</small>']",,Waterpik Ultra Water Flosser,"['B003FSTE4W', 'B001NIZ5U8', 'B00CU9VF2Q', 'B0062N7980', 'B005GD1EP6', 'B001NIZ5V2', 'B07CMTF1H6', 'B07HP7XBZL', 'B07CYYQGLZ', 'B071JSCPWG', 'B000H84D2G', 'B0767Q5BNX', 'B000Q46K86', 'B005FOCNKQ', 'B0746958M6', 'B00C3PKYCE', 'B01684J7P0', 'B07DDRNQ4C', 'B0000302Z6', 'B072LY2FT2', 'B000RLG8JE', 'B00JMLT22K', 'B0765DHTVL', 'B07KSBP93Y', 'B07K86N89K']",,Waterpik,[],"19,437 in Beauty & Personal Care (","['B0755JQ4RF', 'B010NNIZQE', 'B07H5KV2J1', 'B01I9TIJQ0', 'B0042A80WE', 'B0185J8VW6', 'B00TV5GSM4', 'B07D3RXGP2', 'B078J32XBK', 'B00FJXHC72', 'B07MNBBG9Y', 'B01LE409AG', 'B01I9TLON0', 'B072FR8VB2', 'B01GR1HY86', 'B0753YQS3J', 'B00MOPL04O', 'B07BRN75G5', 'B007T9WC06', 'B004Y99EO6', 'B07J9RGXFD', 'B0002AHY6Q', 'B016NKEK06', 'B07C58YNPM', 'B07H1X11V9', 'B003FSTE4W', 'B072W3D3H6', 'B07JVP5P3T', 'B00006WNSA', 'B004W360SW', 'B01MA2XZGM', 'B001MUBL50', 'B07BMT3VR4', 'B000RLG8JE', 'B07MD4M5B4', 'B07GSM39HG', 'B00VRAEJCM', 'B012GUPY2A', 'B0796B6KNY', 'B07BW48X2R', 'B07KS8LHGR', 'B004LXKAWU', 'B0027LSEPS', 'B07469Y8L4', 'B0756FFRF7', 'B0058D2OEO', 'B079ZZMTS7', 'B07CMBMJKP', 'B01H4BQUZG', 'B07JB37694', 'B07G76D9WD', 'B07KVLVFDX', 'B01I9TM2KY', 'B07GST2CSP', 'B07L9DPJMD', 'B002NKLWES', 'B07CMPK3K5', 'B07FY4QRQ7']","{'\n    Product Dimensions: \n    ': '7 x 9 x 6 inches ; 1.32 pounds', 'Shipping Weight:': '1.9 pounds', 'Domestic Shipping: ': 'Item can be shipped within U.S.', 'International Shipping: ': 'This item is not eligible for international shipping.', 'ASIN: ': 'B000GLRREU', 'UPC:': '073950378192 720189222900 881364686358 073950186315 073950278201 802418488261 794437517933 021652489517 073950290760 783318978246 715933314451 971471656532 073950139571 792217539885 799472740247 792217496430 884477268169 073950278195 739502980915 074940278195', 'Item model number:': 'WP-100', 'Batteries': '1 Lithium Polymer batteries required.'}",All Beauty,,,,['https://images-na.ssl-images-amazon.com/images/I/31xtQMrz7dL._SS40_.jpg'],['https://images-na.ssl-images-amazon.com/images/I/31xtQMrz7dL.jpg']
5.0,True,"02 17, 2015",A3VNUU9ZHPWF91,B00567UTKI,Jenny,I love the ingredients and knowing how safe it is to use on my kids.  My 7 year old son refuses to use any other shampoo.  I think we've used all the different varieties and find them all wonderful smelling.,I love the ingredients and knowing how safe it is to ...,1424131200,,"{'Size:': ' 8 oz', 'Scent Name:': ' Coconut Baby'}",,[],,"['Sweet Baby Shampoo is a natural, rich, nutritious, well lathering salon quality shampoo for babies and children with no SLS or any sulfates, parabens, phthalates, anesthetizing ingredients, dyes or endocrine disruptors like lavender oil or tea tree oil. It gently cleanses and nourishes babies hair and body with skin soothing ingredients. The result is beautiful smooth hair and skin in harmony with nature. For adults try our Paradise Island Shampoo.']",,"Sweet Baby Shampoo, 8 oz., Sulfate Free, No Parabens, Phthalates, Dyes, Endocrine Disruptors, SLS Free, Vegan, Natural (Coconut Baby)",[],,Paradise Island,[],"253,218 in Beauty & Personal Care (","['B00SGP6316', 'B07C2SJDCY', 'B06XB17BVH', 'B001339RX4', 'B01A64LIZK', 'B07BV7Q35X', 'B0013LCZ08', 'B01672BWHO', 'B004IM0KYM', 'B009CGW15U', 'B01MS3G850', 'B07CKFXXY2', 'B078XMCKNP', 'B006L3MDDC', 'B07JVH6TDJ', 'B0006FMK98', 'B00K2Y8WWC', 'B003C1AFVI', 'B01MS4T94O', 'B07HMM9SPD', 'B01JLQFIZA', 'B07DGK6HC6', 'B00W33MQPE', 'B00394DVGY', 'B00IUGT7V4', 'B07CL248SF', 'B00IX2J9E0', 'B017MPSHWI', 'B014RDJYUM', 'B00WANN41W', 'B072BY91TD', 'B077VGH3HT', 'B079YZ7K18', 'B004UF1P3M', 'B075CW81NJ', 'B002WC8E7U', 'B00CFGCULY', 'B00QAZ16DO', 'B006Z8B5HS', 'B01BD7V6Y2', 'B00EHDWP4K', 'B003IGY93W', 'B01A64LDPK', 'B07BSTKBH9', 'B002WC8E98', 'B00BT597EA', 'B01A644P8M', 'B072M33453', 'B00PRC3IP0', 'B01MY6IDFR', 'B0052ZKKWG', 'B00N648M66', 'B06Y4X4CSB', 'B000HK1OOY', 'B06Y2DT2GJ']","{'\n    Product Dimensions: \n    ': '2 x 2 x 6.6 inches', 'Shipping Weight:': '10.4 ounces (', 'ASIN: ': 'B006UNQ1RM', 'UPC:': '799959159531 885683464789'}",All Beauty,,,$10.99,[],[]
5.0,False,"02 14, 2016",A25BC1ZM8MKNA8,B014FTKTI4,Amanda,"These are definitely the best press-on nails you can get. They are flexible and adhere more or les instantly. When I took them off after 8 days, it was because they had started to lift slightly at the cuticles and I felt like they were getting in the way a bit, but not one of them actually fell off. I probably could have found a way to re-secure them at the cuticle if I'd wanted to take the time, and they would have lasted longer.

This design is really nice, but I mistook the dark color for black. It is dark chocolate brown. I wear tons of black and wanted the coordination, so that was a little disappointing, but that doesn't mean I dislike the design.",These are definitely the best press-on nails you can get,1455408000,,,,[],,[],,KISS imPRESS &quot;VAMP IT UP&quot;(N) 2x Longer Lasting Short Nails by Broadway Press-On Manicure Nails,"['B01K4YPQQO', 'B01ASB24FO', 'B01N4I6EBB', 'B01MXTVZMQ', 'B01M59Q9FT', 'B01H4C9GDS', 'B01N0MI80M', 'B01HTZZ5DA', 'B010J1L7ZQ', 'B01MAUZTK1', 'B01LFKDJNS', 'B074RPG637', 'B01NAEA0BV', 'B01CEY8DKI', 'B00T9XIFGU', 'B00T9X6XWI', 'B0773TZV6S', 'B0184DL0YY', 'B00ERB527E']",,Broadway,[],"733,885 in Beauty & Personal Care (",[],"{'\n    Item Weight: \n    ': '3.2 ounces', 'Shipping Weight:': '4 ounces', 'ASIN: ': 'B014FTKTI4', 'UPC:': '731509329544'}",All Beauty,,,,[],[]
