overall,verified,reviewTime,reviewerID,asin,reviewerName,reviewText,summary,unixReviewTime,vote,style,image,category,tech1,description,fit,title,also_buy,tech2,brand,feature,rank,also_view,details,main_cat,similar_item,date,price,imageURL,imageURLHighRes
5.0,True,"11 29, 2017",A26L719UKV7FSA,B00QTLBYLI,Joanne Bull,Love it.,Five Stars,1511913600,,{'Color:': ' RightEye'},,[],,[],,"Womens Sexy Signature Phantom Of The Opera Masquerade Mask,RightEye, One size","['B00N48OPJC', 'B076SSHXY3', 'B078Y98MXB', 'B00XVDX8UM', 'B07BB2MWQ8', 'B07FRCYNTV', 'B0789X897N', 'B074MZVMM2', 'B01HBBQQXA', 'B071K9ZSLZ', 'B078YC2Q78', 'B00V39BM4U', 'B0725QTH95', 'B00RJUG7BA', 'B01GE1GJQW', 'B0136UATTC', 'B072N2VC9F', 'B01JS89VOK', 'B01HHVC958', 'B01C48TEF2', 'B071KT3LGD', 'B01MR7I3OW', 'B07H5DT8ZH', 'B07HBZ9HZP', 'B073J6GYCS', 'B001AQM5W4', 'B06XRD3KDW', 'B0158A66C2', 'B07C6YFPN1', 'B01162CJ86', 'B075YZSW6Q', 'B01KFIJTTE', 'B0747NYKMJ', 'B076GLSBQD', 'B009SDU20S', 'B074J2RCJ1', 'B076Q9DYS7', 'B00I8S1B22', 'B00SWAAOLA', 'B0778LP42W', '0984908285', 'B077GLGSX6', 'B0746BW5JL', 'B06XBNGVZ9', 'B0786V52WD', 'B00HS0WJL8', 'B00O2UYLSG', 'B07CKL2XHH', 'B07C19R2LW', 'B075M9Y7WJ', 'B011KOOAZU', 'B06XK4QL8S', 'B06ZYJRSK4', 'B00IOCMQ6W', 'B0755R6C8K', 'B017OKRA74', 'B00T60V8CE', 'B01IN0L4AI', 'B01F3CV4Z4', 'B01D46MFLI', 'B01M1VPLDB', 'B00NQS0S14', 'B018PYG8YY', 'B072KCXXR4', 'B06Y52RK1X', 'B071L1FGRY', 'B07CXSWZ29', 'B07149LM9M', 'B00D0RPR2Q', 'B074C3BPP5', 'B07K5QXX4F', 'B072N3NYZX', 'B01853Y3Z6', 'B075XNB1BB', 'B01KTPJ2NQ', 'B01I9TFL66', 'B073W4Q2KP', 'B01LWE24AJ', 'B06VW234P9', 'B072WL7329', 'B011ZAGU2A', 'B00JGZD0X4', 'B00JGZD944', 'B01M63ZSGB', 'B073VDKKKZ', 'B073VF56GX', 'B01LXT5J8H', 'B00QQQV5WY', 'B00S5MVP9K', 'B0099T3GTK', 'B074FWCJR8', 'B01KTPJ420', 'B01C48XRDW', 'B077G5TWMQ', 'B01N2Z6RZL']",,Bellady,[],"75,222 in Beauty & Personal Care (",[],"{'\n    Item Weight: \n    ': '1.12 ounces', 'Shipping Weight:': '1.1 ounces (', 'ASIN: ': 'B00QTLBYLI', 'UPC:': '702142775654', 'Item model number:': 'ZXG00000439'}",All Beauty,,,$11.99,"['https://images-na.ssl-images-amazon.com/images/I/51-kKpgBl-L._SS40_.jpg', 'https://images-na.ssl-images-amazon.com/images/I/511d35DP57L._SS40_.jpg', 'https://images-na.ssl-images-amazon.com/images/I/51ws82Y%2B-IL._SS40_.jpg', 'https://images-na.ssl-images-amazon.com/images/I/51wCxBzFEoL._SS40_.jpg', 'https://images-na.ssl-images-amazon.com/images/I/51U5chH8KXL._SS40_.jpg', 'https://images-na.ssl-images-amazon.com/images/I/A1ZSK7zudGL._SS40_PKmb-play-button-overlay-thumb_.jpg']","['https://images-na.ssl-images-amazon.com/images/I/51-kKpgBl-L.jpg', 'https://images-na.ssl-images-amazon.com/images/I/511d35DP57L.jpg', 'https://images-na.ssl-images-amazon.com/images/I/51ws82Y%2B-IL.jpg', 'https://images-na.ssl-images-amazon.com/images/I/51wCxBzFEoL.jpg', 'https://images-na.ssl-images-amazon.com/images/I/51U5chH8KXL.jpg', 'https://images-na.ssl-images-amazon.com/images/I/A1ZSK7zudGL.jpg']"
5.0,True,"05 17, 2016",AFZAJSDHHK83D,B004BD9152,Amazon Customer,good,Five Stars,1463443200,,{'Format:': ' Health and Beauty'},,[],,"[""HydraFresh Toner's gentle, non-drying formula refreshes and softens skin in a splash, revealing a smoother, brighter complexion and leaving skin smooth and supple. Beta Hydroxy Acid gently sweeps away dull, tired skin while Pro-Vitamin B5 helps protect against moisture loss. Dermatologist tested for gentleness. 99% alcohol free."", 'By']",,"L'Or&eacute;al Paris Skincare HydraFresh Toner, Alcohol Free Toner with Pro-Vitamin B5 for Face, 8.5 fl. oz.","['B01IER4GL4', 'B00H3R7K5G', 'B000U5O650', 'B00005333G', 'B00EZWU1TO', 'B001EUS64M', 'B002JDUMFO', 'B004GHGA8O', 'B000KOLX7U', 'B002PBCAEQ', 'B07CRSL915', 'B000KONYPY', 'B000NP7K1E', 'B004C112DW', 'B000KPO99I', 'B003RF82UK', 'B008FZ562E', 'B00CD0016I', 'B01F7SUFNG', 'B00B2KDWHA', 'B000KPKC2G', 'B009X62WM6', 'B01MFC0HJ2', 'B0055S4CRY', 'B018KR4TXI', 'B000KONYJK', 'B00LIBJ7U4', 'B01648QDTI', 'B00ALB397Y', 'B00Y1C8P2I', 'B00005333I', 'B06XDNGGHW', 'B004YWRYUY', 'B01M09QQI0', 'B00027D0DU', 'B008EKY8VK', 'B004BD11DM', 'B005H152J6', 'B00M97IU72', 'B00GTC1HG4', 'B00EZWUFGI', 'B017V5J5TI', 'B01FDLASN4', 'B000UGVVHK', 'B0000CC64W', 'B07JJNLF9F', 'B01DPA6OHO', 'B071GN4V72', 'B072MZLXYZ', 'B006GQZQ6K', 'B000UGUQLM', 'B008HBMW78', 'B01LA91S28', 'B00UXPIDH4', 'B01F7SUFW2', 'B004BCXAM8', 'B0012J30LY', 'B017PCGAXQ', 'B017PCGABI', 'B01N288ZXE', 'B00CC6XSSQ', 'B00AYDN0JG', 'B01F7SUFH2']",,L'Oreal Paris,[],"167,810 in Beauty & Personal Care (","['B000U5O650', 'B01IER4GL4', 'B003RF82UK', 'B000KPKC2G', 'B00B4RJP72', 'B06XSNQWZ1', 'B017MPRN64', 'B00CHJU06G', 'B01GSEIPOO', 'B002P3L99G', 'B0081IOGNU', 'B00EZWU1TO', 'B002ZVZ60Q', 'B00H3R7K5G', 'B001E96OU6', 'B0785J2GPS', 'B0000535RA', 'B07CH3ZRQV', 'B000KONYPY', 'B0754GX9FK', 'B01526DXQE', 'B00NLKAVL4', 'B002PBHQP4', 'B00ECQCVK0', 'B00U1YCRD8', 'B00D3JM6FC', 'B074MBRM97', 'B002JDUMFO', 'B016855X98', 'B00LNOV8JO', 'B01JGVQ3SQ', 'B00JXOTBPY', 'B07681YFWZ', 'B01FYLTO10']","{'\n    Product Dimensions: \n    ': '1.7 x 2.7 x 6.4 inches ; 10.4 ounces', 'Shipping Weight:': '10.4 ounces (', 'Domestic Shipping: ': 'Item can be shipped within U.S.', 'International Shipping: ': 'This item is not eligible for international shipping.', 'ASIN: ': 'B004BD9152', 'UPC:': '884870273593 885488349045 890840721537 071249672044 890517144911 885130452659 891779088937 890758540602 885329399161 885138446469 885291969812 799198632765 882121939007', 'Item model number:': ""L'OREAL628024"", 'Discontinued by manufacturer:': 'Yes'}",All Beauty,,,$5.37,"['https://images-na.ssl-images-amazon.com/images/I/41b4nT%2BTGAL._SS40_.jpg', 'https://images-na.ssl-images-amazon.com/images/I/31C64izURCL._SS40_.jpg']","['https://images-na.ssl-images-amazon.com/images/I/41b4nT%2BTGAL.jpg', 'https://images-na.ssl-images-amazon.com/images/I/31C64izURCL.jpg']"
1.0,True,"10 26, 2011",A2WSSHZKZMKC8V,B0010ZBORW,BEEDOO,"The brush I recieved is not the brush shown here.  The brush head is not removable, nor is there an elastic band behind it. This will not work as a dry body brush and should not be categorized as such.  I will be returning the item.",THIS IS NOT AS SHOWN!,1319587200,,{'Color:': ' Body Brush'},,[],,"[""Considering that the average person walks over 8000 steps a day, a spa treatment for your feet is probably long overdue. Simply apply a foot cream, slip on our booties, and they&rsquo;ll use your body heat to seal in the moisture. Remove the booties after a few hours (or overnight) and your feet will look wonderfully soft and feel refreshed. One size fits all. Wash in cold water and hang to dry. 90% unbleached cotton. 10% spandex. Urban Spa has a wide variety of spa quality exfoliating and shower accessories available to give you fresh and smooth skin with all natural products. Pair Urban Spa&rsquo;s wonderful nail and skin products with Pre de Provence's delicately scented bath soaps, lotions, bubble bath, bath gels, and more for the ultimate experience.""]",,"Urban Spa Moisturizing Booties to Keep your Feet Smooth, Hydrated and Moisturized",[],,Urban Spa,"['<span class=""a-size-base a-color-secondary"">\n                We believe that experiencing natural beauty should be an everyday, affordable luxury. And every product should be as authentically French as Pr de Provence.\n            </span>', '<span class=""a-size-base a-color-secondary"">\n                All our products are harvested through responsible sustainable practices.\n            </span>', '<span class=""a-size-base a-color-secondary"">\n                Urban spa products are perfect for gift giving, traveling and for those long days when you want to relax and transform your bathroom into a spa.\n            </span>']","146,621 in Beauty & Personal Care (","['B01DCXXGFC', 'B076ZZ29C7', 'B000JLFFGE', 'B0067K3F7C', 'B013UAWV44', 'B000XJ91VC', 'B00OJDN7DQ', 'B075QPJ4X1', 'B00YL8KJXU', 'B07G6RJZYH', 'B07HKSB2ZX', 'B07G2GMHJP', 'B076ZYNXMN', 'B07K3VVW2T', 'B01COLIUPY', 'B001C1LBG8', 'B0015AK040', 'B0182LBKA2', 'B01F3HZE46', 'B072KDW7GT', 'B01C39A7R6', 'B07FQ8MYP9', 'B004FELNTO', 'B07GVC9L84', 'B078M88D3D', 'B004KTJ5WG', 'B076KMPVX2', 'B00G0U2BUG', 'B07K36ZZN6', 'B00FRIC2JC', 'B06XKVVWQ3', 'B01JAW84T2', 'B0044TTRAM', 'B00TI6PE4O', 'B074N3GY25', 'B00F73ETS4', 'B004RCB24A', 'B01A7HTWMC', 'B000R74S7M', 'B07DD8D8NK', 'B07G6LJBS6', 'B0006NZEAW', 'B078WLKL4M', 'B00VH867DI', 'B01CK9OCKC', 'B005SJMZT2', 'B00HX0MX3M', 'B07HKRLGQ7', 'B005SJAGIE', 'B00L8HEO2Y', 'B072BNL7BK', 'B000JFCF8Q', 'B074PT8GR2', 'B072N33D7N', 'B0021LPK4W']","{'\n    Product Dimensions: \n    ': '8.5 x 0.2 x 4 inches', 'Shipping Weight:': '0.3 ounces (', 'Domestic Shipping: ': 'Item can be shipped within U.S.', 'International Shipping: ': 'This item can be shipped to select countries outside of the U.S.', 'ASIN: ': 'B0010ZBORW', 'UPC:': '771590616000 093832790867', 'Item model number:': '13010MB'}",All Beauty,,,$7.99,"['https://images-na.ssl-images-amazon.com/images/I/51vjEuDcLKL._SS40_.jpg', 'https://images-na.ssl-images-amazon.com/images/I/51kHfm9CtiL._SS40_.jpg', 'https://images-na.ssl-images-amazon.com/images/I/51Hqp3MfalL._SS40_.jpg', 'https://images-na.ssl-images-amazon.com/images/I/51mLY0qTyRL._SS40_.jpg']","['https://images-na.ssl-images-amazon.com/images/I/51vjEuDcLKL.jpg', 'https://images-na.ssl-images-amazon.com/images/I/51kHfm9CtiL.jpg', 'https://images-na.ssl-images-amazon.com/images/I/51Hqp3MfalL.jpg', 'https://images-na.ssl-images-amazon.com/images/I/51mLY0qTyRL.jpg']"
5.0,True,"01 9, 2015",A13QNQ47MX227E,B000FOI48G,James Apperson,great,Five Stars,1420761600,,,,[],,"[""Premium dental water jet with dramatically improved design, large selection of accessories. Dentists' choice. Clinically proven. Covered lid tip storage. 6 tips included: 2 Classic Jet Tip, Plaque Seeker Tip, Orthodontic Tip, Pik Pocket Tip and Toothbrush Tip."", '<div class=""aplus""> <div class=""fourth-col""> <div class=""leftImage"" style=""width: 193px;""> <img src=""https://images-na.ssl-images-amazon.com/images/G/01/hpc/detail-page/c26-B000GLRREU-woman-small.jpg"" width=""193"" height=""300"" border=""0"" alt=""Waterpik Water Flossers are the easy and more effective way to floss""> <br><br><br><br> </div> <div class=""leftImage"" style=""width: 285px;""> <a href=""https://images-na.ssl-images-amazon.com/images/G/01/hpc/detail-page/c26-B000GLRREU-gingivitis-reduction.jpg"" title=""Learn more about reducing gingivitis""> <img src=""https://images-na.ssl-images-amazon.com/images/G/01/hpc/detail-page/c26-B000GLRREU-gingivitis-reduction-small.jpg"" width=""285"" height=""245"" border=""0"" alt=""Reduce gingivitis with a Waterpik Water Flosser""></a> <div class=""imageCaption"">The Waterpik Water Flosser is more effective than Sonicare Air Floss for improving gum health. <a href=""https://images-na.ssl-images-amazon.com/images/G/01/hpc/detail-page/c26-B000GLRREU-gingivitis-reduction.jpg"">View larger</a></div> <br><br><br><br> </div> <div class=""leftImage"" style=""width: 298px;""> <a href=""https://images-na.ssl-images-amazon.com/images/G/01/hpc/detail-page/c26-B000GLRREU-water-flosser-tip-guide-large.jpg"" title=""Learn more about Water Flosser tips""><img src=""https://images-na.ssl-images-amazon.com/images/G/01/hpc/detail-page/c26-B000GLRREU-water-flosser-tip-guide-small.jpg"" width=""298"" height=""230"" border=""0"" alt=""""> </a><div class=""imageCaption""> <a href=""https://images-na.ssl-images-amazon.com/images/G/01/hpc/detail-page/c26-B000GLRREU-water-flosser-tip-guide-large.jpg"" title="""">View the Water Flosser Tip Selector Guide</a></div> </div> </div> <div class=""half-col""> <h4>The Easy and More Effective Way to Floss</h4>', ""The Waterpik Water Flosser is the easy and more effective way to floss. And it's perfect for anyone with braces, implants, crowns, bridges, or periodontal pockets. Water flossing for about a minute a day comfortably removes up to 99.9% of plaque from treated areas as it gently massages the gums to improve overall oral health. Waterpik Water Flossers are the only brand clinically proven to be up to 50% more effective than traditional dental floss and up to 80% more effective than Sonicare Air Floss for improving gum health."", ""Whether you prefer gentle water pressure or deep cleansing, the Ultra Water Flosser's 10 adjustable water-pressure settings give you optimal control. Select a personalized setting between 10 to 90 PSI with 1,400 pulses per minute to keep your gums healthy. The Ultra Water Flosser cleans deep between teeth and below the gumline, while massaging and stimulating the gums. Clinical studies show that when used regularly, the Ultra Water Flosser gives you healthier gums in just 14 days."", ""The Ultra Water Flosser's improved design features a high-volume, covered reservoir with an in-lid tip storage compartment. It is also smaller and quieter than previous models. And its ergonomic handle design is comfortable to hold and offers a convenient pause button."", 'Since 1962, Water Pik, Inc. has been a leader in developing and manufacturing innovative personal and oral health care products. Over the years, Water Pik has acquired more than 500 patents, maintaining a steadfast commitment to developing innovative products that enable people to treat themselves better. Waterpik brand products are recognized for their award-winning design and technology.', 'With the number-one recommended Water Flosser, Waterpik is one of the most trusted oral-health brands of dental professionals throughout the world. The company is committed to developing products that not only enhance the health and well-being of customers, but also conserve water and energy.', '<img src=""https://images-na.ssl-images-amazon.com/images/G/01/hpc/detail-page/c26-B000GLRREU-upto-999p.jpg"" width=""160"" height=""155"" border=""0"" alt=""Remove plaque"" ><br> <b>Effective Plaque Removal</b><br><small>Proven in laboratory tests to remove up to 99.9% of plaque from treated areas in 3 seconds.</small>', '<img src=""https://images-na.ssl-images-amazon.com/images/G/01/hpc/detail-page/c26-B000GLRREU-upto-50p.jpg"" width=""160"" height=""155"" border=""0"" alt=""Improve gum health""><br> <b>Improved Gum Health</b><br><small>Clinically proven up to 50% more effective than dental floss for improving gum health.</small>', '<img src=""https://images-na.ssl-images-amazon.com/images/G/01/hpc/detail-page/c26-B000GLRREU-upto-3X.jpg"" width=""160"" height=""155"" border=""0"" alt=""Clean braces more effectively""><br> <b>Superior Cleaning Around Braces</b><br><small>Clinically proven up to 3X as effective as dental floss for cleaning around braces with the orthodontic tip.</small>', '<img src=""https://images-na.ssl-images-amazon.com/images/G/01/hpc/detail-page/c26-B000GLRREU-14day.jpg"" width=""160"" height=""155"" border=""0"" alt=""14 days for healthier gums, guaranteed""><br> <b>Healthier Gums Guaranteed</b><br><small>If you aren\'t satisfied that your gums are healthier after using the Waterpik Water Flosser for 14 days, feel free to return it to us for a full refund.</small>']",,Waterpik Ultra Water Flosser,"['B003FSTE4W', 'B001NIZ5U8', 'B00CU9VF2Q', 'B0062N7980', 'B005GD1EP6', 'B001NIZ5V2', 'B07CMTF1H6', 'B07HP7XBZL', 'B07CYYQGLZ', 'B071JSCPWG', 'B000H84D2G', 'B0767Q5BNX', 'B000Q46K86', 'B005FOCNKQ', 'B0746958M6', 'B00C3PKYCE', 'B01684J7P0', 'B07DDRNQ4C', 'B0000302Z6', 'B072LY2FT2', 'B000RLG8JE', 'B00JMLT22K', 'B0765DHTVL', 'B07KSBP93Y', 'B07K86N89K']",,Waterpik,[],"19,437 in Beauty & Personal Care (","['B0755JQ4RF', 'B010NNIZQE', 'B07H5KV2J1', 'B01I9TIJQ0', 'B0042A80WE', 'B0185J8VW6', 'B00TV5GSM4', 'B07D3RXGP2', 'B078J32XBK', 'B00FJXHC72', 'B07MNBBG9Y', 'B01LE409AG', 'B01I9TLON0', 'B072FR8VB2', 'B01GR1HY86', 'B0753YQS3J', 'B00MOPL04O', 'B07BRN75G5', 'B007T9WC06', 'B004Y99EO6', 'B07J9RGXFD', 'B0002AHY6Q', 'B016NKEK06', 'B07C58YNPM', 'B07H1X11V9', 'B003FSTE4W', 'B072W3D3H6', 'B07JVP5P3T', 'B00006WNSA', 'B004W360SW', 'B01MA2XZGM', 'B001MUBL50', 'B07BMT3VR4', 'B000RLG8JE', 'B07MD4M5B4', 'B07GSM39HG', 'B00VRAEJCM', 'B012GUPY2A', 'B0796B6KNY', 'B07BW48X2R', 'B07KS8LHGR', 'B004LXKAWU', 'B0027LSEPS', 'B07469Y8L4', 'B0756FFRF7', 'B0058D2OEO', 'B079ZZMTS7', 'B07CMBMJKP', 'B01H4BQUZG', 'B07JB37694', 'B07G76D9WD', 'B07KVLVFDX', 'B01I9TM2KY', 'B07GST2CSP', 'B07L9DPJMD', 'B002NKLWES', 'B07CMPK3K5', 'B07FY4QRQ7']","{'\n    Product Dimensions: \n    ': '7 x 9 x 6 inches ; 1.32 pounds', 'Shipping Weight:': '1.9 pounds', 'Domestic Shipping: ': 'Item can be shipped within U.S.', 'International Shipping: ': 'This item is not eligible for international shipping.', 'ASIN: ': 'B000GLRREU', 'UPC:': '073950378192 720189222900 881364686358 073950186315 073950278201 802418488261 794437517933 021652489517 073950290760 783318978246 715933314451 971471656532 073950139571 792217539885 799472740247 792217496430 884477268169 073950278195 739502980915 074940278195', 'Item model number:': 'WP-100', 'Batteries': '1 Lithium Polymer batteries required.'}",All Beauty,,,,['https://images-na.ssl-images-amazon.com/images/I/31xtQMrz7dL._SS40_.jpg'],['https://images-na.ssl-images-amazon.com/images/I/31xtQMrz7dL.jpg']
5.0,True,"06 7, 2014",AVBVMQTFARJIT,B0002YLWOC,meet00,"This stuff is the best but I wish I bought the sample pack first then I could think of how to layer the scents and what mixes I could do . I like sun + petal + pear  , I find since the scent in the concreta last longer I have to add the others on later to freshen up . If you want to find out mixes go on the zents homepage look under attar ( just pick any scent )  then  tips",Luv,1402099200,,,,[],,"[""A silky balm for hair and body, Zents Body Concreta is comprised of healing, natural ingredients like beeswax and Shea butter for deliciously soft skin. This sweetly fragrant, intensely hydrating formula is presented in an elegant stone box. The delectable blend of vanilla, sweet orange, pink grapefruit and sandalwood make for a deliciously warm and pure ''Sun'' fragrance.""]",,"Zents Concreta, Firming Repair Balm and Solid Parfum, With Pure Organic Shea Butter and Organic Coconut Oil in Soapstone,1.25 fl oz/37.5 millileters (Sun)",[],,Zents,[],"215,541 in Beauty & Personal Care (","['B07G2XLV2B', 'B07J9R8HN6', 'B07J64KZHN', 'B07JVH7B4P', 'B00ODBP430', 'B00ODBP10G', 'B06WRSGV1L', 'B002MWS1KU', 'B002MWZKO0', 'B00HVDOZ1O', 'B0070Z1B06', 'B01N14NVNI']","{'\n    Item Weight: \n    ': '4 ounces', 'Shipping Weight:': '10.4 ounces (', 'ASIN: ': 'B0002YLWOC', 'UPC:': '787734523363 793379296746 787734401531', 'Item model number:': '617267003097'}",All Beauty,,,$44.00,"['https://images-na.ssl-images-amazon.com/images/I/3159vCns6dL._SS40_.jpg', 'https://images-na.ssl-images-amazon.com/images/I/31WGzmz%2BCVL._SS40_.jpg']","['https://images-na.ssl-images-amazon.com/images/I/3159vCns6dL.jpg', 'https://images-na.ssl-images-amazon.com/images/I/31WGzmz%2BCVL.jpg']"
5.0,True,"01 2, 2017",A3AXNE0VVP6SU7,B01C2DEG48,Shelly Montgomery,"The reviews have been bad. However, not everyone takes the time to fully get the care of these.
Shampoo, conditioner, leave in conditioner and hair sprays are available for synthetic hair.
It takes awhile to get the hang of it, once you do, with sincere effort, they become prettier than the pictures. The ""cord"" some talk about is actually used for way the hair lays etc. it's VERY useful when you separate the curls.
I'll post a pic when it arrives. I own approximately 10 . And love them",Know your synthetic.,1483315200,,,,[],,[],,DENIYA Synthetic Curly Clip In Ponytail Hair Extensions Fake Ponytail Hairpiece,[],,,[],"1,118,218 in Beauty & Personal Care (",[],"{'Shipping Weight:': '4 ounces (', 'ASIN: ': 'B01C2DEG48'}",All Beauty,,,$12.90,[],[]
5.0,True,"04 6, 2018",AG30ZG4WVXXU1,B00CQ16CT4,Christine Meadows,"I love them. The packaging is cute (comes in a small square of styrofoam inside of a little baggie) and they're small, which is just what I wanted. About the side of a regular earring. They're good quality for the price, which is good because I'm cheap haha

At first, I was a little worried about how small the ball is on the end that goes in your shnauz, but it isn't a problem at all.",Great quality for the price.,1522972800,,,,[],,"['Colorful Stainless Steel Rhinestone Nose Studs, 20 Pieces']",,"Tojwi Colorful Stainless Steel Rhinestone Nose Studs, 20 Pieces","['B01H3IVSAC', 'B0105Q3R4E', 'B01G6QOEO4', 'B01H56MRZ2', 'B005QWWISO', 'B07BT8X35B', 'B0782BMGT5', 'B005WUJSXS', 'B075652DF1', 'B0774CJTB4', 'B073GZ7WGD', 'B00CW53Z7G', 'B076DCXN7G', 'B075CYQTNW', 'B01N9VPGT4', 'B019C5QATS', 'B0085SZFRM', 'B07839BKVB', 'B01HGT2D84', 'B07856Q8V4', 'B01CG4V3BC', 'B079XFRLJ8', 'B0785R7DDQ', 'B07BMPGN73', 'B073WVX797', 'B071W8425D', 'B078ZCPJ86', 'B071FF91HR', 'B077CFRCR3', 'B07CQH3HV3', 'B01GCN4J0K', 'B0781G62VD', 'B011EBHQJQ', 'B01LS0DCHS', 'B06XTWJPCT', 'B0756SC7Y5', 'B01HRGFHMK', 'B071NDFP72', 'B072L63NSR', 'B01NCF6M4D', 'B072Q8Z1F8', 'B077QNQNG2', 'B00URT9QEU', 'B06Y53VYFR', 'B01489YX5Q', 'B01MTYANEM', 'B012ATOXTC', 'B016A68H0C', 'B077HCNSS2', 'B01EGMDGN0', 'B07BS9V4SG', 'B00HY8H6Q2', 'B077HCB2WX', 'B078NPFLY2', 'B07B2FZCJK', 'B01M615HNW', 'B06XYN3PL7', 'B06XTKCMFC', 'B078G7SJ45', 'B00USIHJZ8', 'B00UL1XL3Q', 'B01M8MLNFY', 'B0725ZWXSZ', 'B01FX9NC6Q', 'B074W3Y3V3', 'B014VV8DQG', 'B0716FHSB5', 'B0764G9X4W', 'B078JPB1MX', 'B0753713ML', 'B074W5HJWF', 'B0785RMXYZ', 'B07CSM1GWS', 'B07BF6WBNQ', 'B073PC7DX8', 'B06XWFTH6Q', 'B00XBY04ZS', 'B074X7GV68']",,Tojwi,[],"71,337 in Beauty & Personal Care (","['B07K1NT898', 'B07B7JLVF4', 'B071ZP5HH1', 'B06XBY9N8J', 'B07LG3W5HM', 'B000WZSIMA', 'B073PC7DX8', 'B07C5CYQJ9', 'B01H3IVSAC', 'B01N9VPGT4', 'B078M344RG', 'B0782BMGT6', 'B01CG4V3BC', 'B075652DF1', 'B07GWJFDM9', 'B07HQXGCFW', 'B07CWRGVRV', 'B07LFV1YDW', 'B06XV6QC86', 'B06XPQR8ZS', 'B07M8VJXQL', 'B07BNM9YCC', 'B01G6QOEO4', 'B0105Q3R4E', 'B0785QJBV3', 'B019C5QATI', 'B01DK9FC78', 'B0775TD7DC', 'B0085SZFRM', 'B07D5CL3HM', 'B07BZGS9V9', 'B07CVWNBPS', 'B06XWFTH6Q', 'B074W81WDS', 'B077G2X764', 'B07M8SLG6V', 'B00PUR5CEW', 'B07FQQPN6Y', 'B01H56MRZ2', 'B07DWXVBKK', 'B0716FHSB5', 'B00URT9QEU', 'B07HQZ6BB7', 'B07C5ZRWY1', 'B0046ZFPJQ', 'B07CQXS72F', 'B06XTCTXJ2', 'B079XFRLJ8', 'B078NQ2HH1', 'B07C3D1M68', 'B012ATOXTC', 'B01CG4V04C', 'B01N9SMH4P', 'B074W4TR2B', 'B07BKXL2D1', 'B06WVZFKM4', 'B016A68GSK', 'B005QWWISO', 'B07DFZ358Q']","{'Shipping Weight:': '0.3 ounces (', 'ASIN: ': 'B00CQ16CT4', 'UPC:': '781549255082 755332220175 794437091426 614373069153', 'Item model number:': 'na'}",All Beauty,,,$3.82,"['https://images-na.ssl-images-amazon.com/images/I/413empNys5L._SS40_.jpg', 'https://images-na.ssl-images-amazon.com/images/I/41vsaXTTETL._SS40_.jpg', 'https://images-na.ssl-images-amazon.com/images/I/413empNys5L._SS40_.jpg', 'https://images-na.ssl-images-amazon.com/images/I/415Ez6UhTJL._SS40_.jpg']","['https://images-na.ssl-images-amazon.com/images/I/413empNys5L.jpg', 'https://images-na.ssl-images-amazon.com/images/I/41vsaXTTETL.jpg', 'https://images-na.ssl-images-amazon.com/images/I/413empNys5L.jpg', 'https://images-na.ssl-images-amazon.com/images/I/415Ez6UhTJL.jpg']"
5.0,True,"09 30, 2015",A33I5DDAOS2AF5,B005V3B1HC,raymond,had a problem with shipping at first then the company fixed it right away I'm SUPER happy amazing product,... first then the company fixed it right away I'm SUPER happy amazing product,1443571200,,,,[],,[],,IQ Natural Mineral Makeup Sample Kit with 5 piece Black Brush Kit (Tan Shade) Try Us Today!,['B002KOCOCG'],,,[],"582,398 in Beauty & Personal Care (",[],"{'Shipping Weight:': '7.2 ounces', 'ASIN: ': 'B005V3B1HC', 'UPC:': '856549003213'}",All Beauty,,,,[],[]
5.0,True,"07 13, 2018",ATHNM9SW89UH6,B01BI4O5IY,Alex,"Was a gag gift but went over very well, she loved it & many many laughs were enjoyed",she loved it & many many laughs were enjoyed,1531440000,,,,[],,[],,Functional Silicone Rubber Face Facial Slimmer Exercise Mouthpiece Anti Wrinkle by Abcstore99,"['B00QK3MW3O', 'B0096Q8AXS', 'B074SH9GZ2', 'B006LZR8J4', 'B00STNDXVS', 'B01C84VQVC', 'B01JIYBD68', 'B0787VKNVN', 'B00V5OI7D2', 'B00UL2E3F0', 'B01MSQFMUP', 'B01N4R5VY2', 'B00QK2X1ZS', 'B07C2MN4ZW', 'B00U5LKSQU', '0545261244', 'B06X6GRJHW']",,Abcstore99,[],"270,566 in Beauty & Personal Care (",[],"{'\n    Product Dimensions: \n    ': '3 x 2.9 x 1.4 inches ; 0.64 ounces', 'Shipping Weight:': '0.8 ounces (', 'ASIN: ': 'B01BI4O5IY'}",All Beauty,,,$4.99,"['https://images-na.ssl-images-amazon.com/images/I/51FF0Y%2BRROL._SS40_.jpg', 'https://images-na.ssl-images-amazon.com/images/I/41iyaMXjqqL._SS40_.jpg', 'https://images-na.ssl-images-amazon.com/images/I/418STspd2rL._SS40_.jpg', 'https://images-na.ssl-images-amazon.com/images/I/41UxEY7bRfL._SS40_.jpg', 'https://images-na.ssl-images-amazon.com/images/I/41hvp2D0G1L._SS40_.jpg']","['https://images-na.ssl-images-amazon.com/images/I/51FF0Y%2BRROL.jpg', 'https://images-na.ssl-images-amazon.com/images/I/41iyaMXjqqL.jpg', 'https://images-na.ssl-images-amazon.com/images/I/418STspd2rL.jpg', 'https://images-na.ssl-images-amazon.com/images/I/41UxEY7bRfL.jpg', 'https://images-na.ssl-images-amazon.com/images/I/41hvp2D0G1L.jpg']"
